Title,Content Pillar,Geo Target,Primary Keyword,Secondary Keywords,Word Count,Publish Date
ESOP Management in HRMS: The Feature Every Indian Startup Funding Round Now Demands,HRMS,Pan-India,ESOP management HRMS India 2026,"ESOP tracking software India, employee stock options HRMS India, equity compensation platform India, ESOP module HR software India",1500,2026-06-27 07:00
AI Is Writing Performance Reviews — and Indian HR Managers Are Furiously Divided,HR Automation,Pan-India,AI performance reviews India 2026,"AI appraisal software India, automated performance review India, AI HR evaluation India, machine written appraisal India",1400,2026-06-27 11:30
The Fractional CHRO Model: Why India's Smartest Startups Are Choosing Part-Time HR Leadership,HR Services,Pan-India,fractional CHRO India startups 2026,"part time CHRO India, outsourced HR leadership India, fractional HR leader India, CHRO on demand India startup",1500,2026-06-27 17:00
Skills-Based Hiring in India 2026: Why Degrees Are Officially Losing to Competency Tests,AI Recruitment,Pan-India,skills based hiring India 2026,"competency hiring India, degree vs skills hiring India, skill assessment hiring India, skills first recruitment India 2026",1600,2026-06-27 20:00
Moonlighting Policy Management: How HRMS Is Solving India's Most Explosive 2026 Workplace Debate,HRMS,Pan-India,moonlighting policy management HRMS India,"employee dual employment HRMS India, moonlighting tracking India, secondary job policy HR software India, HRMS moonlighting detection India",1500,2026-06-28 07:00
Predictive Attrition Is Here: How Indian Companies Are Using AI to See Resignations Coming,HR Automation,Pan-India,predictive attrition AI India 2026,"attrition prediction software India, AI employee resignation forecast India, retention AI tool India, predict employee exit India",1600,2026-06-28 11:30
Qatar Expansion Playbook: What Indian Companies Need to Know About Gulf HR and Payroll Compliance,HR Services,India / Qatar,Qatar HR compliance Indian companies,"Indian company Qatar payroll, Gulf HR services India company, expand Qatar India business HR, Qatar labour law Indian employees 2026",1500,2026-06-28 17:00
ChatGPT-Proof Hiring: How India's Sharpest Recruiters Are Defeating AI-Written CVs in 2026,AI Recruitment,Pan-India,detect AI written resume India 2026,"ChatGPT resume detection India, fake CV AI India, AI proof hiring India, screen AI generated applications India",1400,2026-06-28 20:00
4-Day Work Week HRMS Setup: How Forward-Thinking Indian Companies Are Already Configuring for It,HRMS,Pan-India,4 day work week HRMS India 2026,"four day week HR software India, compressed week HRMS India, 32 hour work week HR India, flexible schedule HRMS India",1400,2026-06-29 07:00
AI Exit Interview Analysis: How Indian Companies Are Finally Learning the Real Reason Talent Leaves,HR Automation,Pan-India,AI exit interview analysis India 2026,"automated exit interview India, AI offboarding insights India, exit data analysis HR India, employee departure trends India AI",1500,2026-06-29 11:30
Toxic Workplace Detection with AI: The HR Technology Indian Companies Did Not Know They Were Missing,HR Services,Pan-India,toxic workplace detection AI India,"workplace culture assessment AI India, HR toxic environment tool India, culture analytics India, employee sentiment AI India HR",1600,2026-06-29 17:00
Gen Z Hiring in India 2026: The Brutal Honest Truth About What They Actually Demand From Employers,AI Recruitment,Pan-India,Gen Z hiring India 2026 expectations,"hiring Gen Z India, Gen Z workplace demands India, recruit Gen Z India 2026, youngest workforce India hiring strategy",1500,2026-06-29 20:00
AI Salary Benchmarking in India: How HR Teams Are Finally Getting Compensation Exactly Right,HRMS,Pan-India,AI salary benchmarking India 2026,"compensation benchmarking tool India, AI pay scale India, salary intelligence platform India, market salary data HR India 2026",1500,2026-06-30 07:00
Automated Statutory Compliance: How HRMS Is Eliminating the Lakhs-Level Mistakes in Indian HR,HR Automation,Pan-India,automated statutory compliance HRMS India,"PF ESI TDS automation HRMS India, statutory compliance error prevention India, labour law HRMS India, compliance automation HR software India",1600,2026-06-30 11:30
Australia HR Compliance for Indian Companies Running Remote Teams Across Borders in 2026,HR Services,Australia / India,Australia HR compliance Indian companies remote teams,"Indian company Australia HR law, cross border payroll India Australia, Fair Work Act Indian employer, Australia employment compliance India firm",1500,2026-06-30 17:00
The Great Talent Paradox: Why Indian Companies Cannot Hire Despite 15 Million Job Seekers,AI Recruitment,Pan-India,India talent paradox hiring crisis 2026,"skill gap India hiring 2026, why cant companies hire India, talent shortage India IT, hiring crisis India despite unemployment",1800,2026-06-30 20:00
HRMS for Manufacturing Shift Workers: Managing Rotating Schedules and Night Shifts Across India,HRMS,Pan-India,HRMS shift management manufacturing India,"rotating shift HR software India, night shift HRMS India, factory workforce scheduling India, shift worker payroll HRMS India",1500,2026-07-01 07:00
How AI Salary Negotiation Tools Are Changing the Offer Letter Game for Indian Recruiters,HR Automation,Pan-India,AI salary negotiation tool India recruiter,"offer letter AI India, salary offer automation India, AI compensation negotiation India, smart offer generation India HR",1400,2026-07-01 11:30
The HR Audit Checklist Every Indian Company Must Complete Before Scaling Past 100 People,HR Services,Pan-India,HR audit checklist India scale 100 employees,"HR audit India company, pre-scale HR review India, grow past 100 HR India, HR health check India companies, people audit India startup",1600,2026-07-01 17:00
Internal Mobility vs External Hiring: The Strategy That Is Actually Winning in Indian Companies 2026,AI Recruitment,Pan-India,internal mobility vs external hiring India 2026,"promote from within India companies, internal vs external recruitment India, talent mobility strategy India, inside hiring India vs outside",1500,2026-07-01 20:00
Employee Wellness Modules in HRMS: From Corporate Checkbox to Business-Critical Investment in India,HRMS,Pan-India,employee wellness HRMS module India 2026,"wellness features HR software India, mental health HRMS India, employee wellbeing platform India, wellness program HRMS integration India",1400,2026-07-02 07:00
How AI Is Transforming Workforce Planning in India's Rs 3 Lakh Crore Pharmaceutical Sector,HR Automation,Pharma India,AI workforce planning pharma India 2026,"pharmaceutical HR automation India, pharma HRMS India, life sciences workforce India, drug company HR software India",1500,2026-07-02 11:30
The HR Services Consolidation Wave: Why Indian Companies Are Ending Multi-Vendor HR Hell in 2026,HR Services,Pan-India,HR services consolidation India single vendor 2026,"all in one HR services India, single HR vendor India, consolidate HR providers India, unified HR service India 2026",1400,2026-07-02 17:00
Why India's Top 1 Percent Talent Is Choosing Startups Over MNCs: The 2026 Data Will Surprise You,AI Recruitment,Pan-India,top talent India startups vs MNC 2026,"elite talent India startups preference, top engineers India startup vs corporate, why best talent joins startups India 2026, MNC vs startup talent India",1600,2026-07-02 20:00
Attendance and Leave Management for India's Remote-First Companies: The 2026 HRMS Non-Negotiables,HRMS,Pan-India,attendance leave management remote HRMS India 2026,"remote attendance software India, work from home HRMS India, leave tracking remote India, hybrid attendance management India",1400,2026-07-03 07:00
Contract Workforce Automation: How HRMS Is Finally Solving India's Gig Economy HR Compliance Crisis,HR Automation,Pan-India,contract workforce automation HRMS India,"gig economy HRMS India, freelancer HR compliance India, contract worker payroll India, temp staff management HRMS India",1500,2026-07-03 11:30
What India's Four New Labour Codes Mean for Every SMB HR Strategy Starting Now,HR Services,Pan-India SMB,India labour code 2026 SMB HR strategy,"new labour law India SMB, four labour codes India business, labour code compliance India, India labour reform HR impact 2026",1600,2026-07-03 17:00
The Rise of the AI Recruiter in India: Will Human Talent Acquisition Professionals Survive the Decade?,AI Recruitment,Pan-India,AI recruiter India future human talent acquisition,"will AI replace recruiters India, AI recruitment threat India, future recruiter job India, AI vs human hiring India 2026",1700,2026-07-03 20:00
Document Management in HRMS: Why Going Fully Paperless Is No Longer Optional for Indian Businesses,HRMS,Pan-India,HRMS document management paperless India 2026,"digital document HRMS India, paperless HR India, employee document storage software India, HRMS digital records India",1400,2026-07-04 07:00
"How India's Top FMCG Companies Are Using HR Automation to Manage 10,000-Plus Field Staff Efficiently",HR Automation,Pan-India,HR automation FMCG field staff India,"FMCG HR software India, field force HR management India, large workforce automation India FMCG, 10000 employee HR India",1500,2026-07-04 11:30
Payroll Outsourcing in India 2026: When It Pays Off and When It Quietly Costs You More,HR Services,Pan-India,payroll outsourcing India 2026 cost benefit,"outsource payroll India, payroll service provider India 2026, managed payroll India, payroll BPO India cost analysis",1500,2026-07-04 17:00
The Offer Letter Ghost: Why Indian Candidates Are Accepting Jobs and Then Simply Disappearing,AI Recruitment,Pan-India,candidates ghosting after offer letter India 2026,"offer letter ghosting India, candidate dropoff India, why candidates ghost India employers, post offer drop India 2026",1400,2026-07-04 20:00
HR Analytics Dashboard: The 12 Metrics India's Most Data-Driven HR Leaders Monitor Every Single Day,HRMS,Pan-India,HR analytics dashboard metrics India 2026,"HR KPI dashboard India, people analytics metrics India, HR reporting daily India, workforce data tracking India companies",1600,2026-07-05 07:00
From Manual Appraisals to AI Performance Intelligence: The Shift That Is Dividing Indian Boardrooms,HR Automation,Pan-India,AI performance intelligence India replace appraisals,"AI appraisal system India, automated KPI tracking India, performance intelligence HR India, ditch manual appraisals India",1500,2026-07-05 11:30
PEO vs EOR vs Managed HR: The Decision Framework Every Indian Business Owner Has Needed,HR Services,Pan-India,PEO EOR managed HR India comparison,"employer of record India, professional employer organisation India, choose PEO EOR India, managed HR model India SMB 2026",1600,2026-07-05 17:00
Job Description Optimisation with AI: How Indian Companies Are Getting 3x More Qualified Applications,AI Recruitment,Pan-India,AI job description optimisation India 3x applications,"optimise JD with AI India, AI job post India, better job description India AI, recruitment copy AI India 2026",1400,2026-07-05 20:00
HRMS for Bootstrapped Indian Startups: Enterprise-Grade HR Features on a Zero-Frills Budget,HRMS,Pan-India,HRMS bootstrapped startups India affordable,"cheap HRMS India startup, affordable HR software India, low cost HRMS India, free tier HRMS India startup 2026",1500,2026-07-06 07:00
Workforce Redeployment with AI: How Smart Indian Companies Are Reskilling Instead of Laying Off,HR Automation,Pan-India,AI workforce redeployment reskilling India 2026,"reskill employees AI India, workforce transition AI India, internal mobility AI India, avoid layoffs reskilling India 2026",1600,2026-07-06 11:30
The Real Cost of a Bad HR Hire: Why Indian Companies Are Running Back to Outsourced HR Models,HR Services,Pan-India,cost of bad HR hire India outsourcing,"wrong HR hire India cost, HR hiring mistake India, why outsource HR India, bad internal HR India 2026",1400,2026-07-06 17:00
Blind Hiring with AI in India 2026: Is This the Answer to Our Diversity and Inclusion Emergency?,AI Recruitment,Pan-India,blind hiring AI India diversity 2026,"AI blind recruitment India, bias free hiring AI India, diversity inclusion AI recruitment India, anonymous hiring India 2026",1500,2026-07-06 20:00
Mental Health Leave in HRMS: How India's Most Progressive Companies Are Rewriting Leave Policy Right Now,HRMS,Pan-India,mental health leave HRMS India 2026 policy,"mental wellness leave India companies, HRMS mental health module India, psychological leave policy India, wellbeing leave tracking HRMS India",1500,2026-07-07 07:00
AI Compensation Benchmarking: How Funded Indian Startups Are Matching MNC Salary Packages at Last,HR Automation,Pan-India,AI compensation benchmarking Indian startups vs MNC,"match MNC salary startup India AI, compensation AI tool India startup, salary gap AI benchmark India, startup pay package India 2026",1600,2026-07-07 11:30
Global Payroll for Indian Companies with International Teams: The 2026 Compliance Handbook,HR Services,India Global,global payroll Indian companies international teams 2026,"multi country payroll India company, cross border payroll India, international HR compliance Indian firm 2026, global payroll software India",1700,2026-07-07 17:00
From LinkedIn Profile to Signed Offer in 14 Days: How AI Is Compressing India's Hiring Timelines,AI Recruitment,Pan-India,AI compress hiring timeline India 14 days,"fast hiring AI India, reduce time to hire India, 14 day recruitment India AI, hire faster AI platform India",1500,2026-07-07 20:00
The HRMS Contract Renewal Audit: 10 Critical Questions Every Indian HR Manager Must Ask First,HRMS,Pan-India,HRMS renewal audit India questions HR manager,"HR software review India renew, HRMS evaluation checklist India, audit HRMS contract India, HRMS vendor review India 2026",1400,2026-07-08 07:00
AI Workforce Forecasting: How Indian CFOs Are Using HR Data to Model Headcount and Cost,HR Automation,Pan-India,AI workforce forecasting CFO India HR data headcount,"headcount planning AI India, HR financial modelling India CFO, workforce cost forecast India AI, people planning CFO India 2026",1500,2026-07-08 11:30
HR Due Diligence During M and A: What Every Indian Company Must Get Right Before the Deal Closes,HR Services,Pan-India,HR due diligence M&A India 2026,"merger acquisition HR India, M&A HR compliance India, people due diligence India acquisition, HR audit M&A India companies",1600,2026-07-08 17:00
Campus to Corporate: How AI Is Finally Bridging India's Freshers Skill Gap in 2026,AI Recruitment,Pan-India,AI freshers skill gap India campus hiring 2026,"fresher hiring AI India 2026, campus recruitment AI India, fresh graduate skill gap India, AI screen freshers India",1500,2026-07-08 20:00
Integration-First HRMS: How India's Most Ambitious Companies Are Building Connected HR Tech Stacks,HRMS,Pan-India,integration first HRMS India HR tech stack 2026,"HRMS integrations India 2026, connect HR tools India, HR software ecosystem India, HRMS API first India, tech stack HR India",1500,2026-07-09 07:00
HR Chatbots in Indian Workplaces: Separating the Genuine ROI from the Expensive AI Hype,HR Automation,Pan-India,HR chatbot ROI India vs hype 2026,"HR bot India real value, AI chatbot HR India ROI, HRMS chatbot India business case, conversational AI HR India 2026",1400,2026-07-09 11:30
The CHRO Effect: Why Indian Organisations With Strong HR Leadership Are Outperforming Their Sector,HR Services,Pan-India,CHRO effect India company performance 2026,"CHRO impact India, strong HR leadership India performance, chief human resources officer India business, HR leader company growth India",1600,2026-07-09 17:00
Passive Candidate Outreach with AI: How India's Best Recruiters Are Winning the Hidden Talent War,AI Recruitment,Pan-India,passive candidate outreach AI India recruiters,"AI passive sourcing India, recruit passive talent India, hidden job market AI India, passive candidate strategy India 2026",1500,2026-07-09 20:00
HRMS for Company Culture Management: The Feature Indian HR Leaders Are Loudly Demanding in 2026,HRMS,Pan-India,HRMS culture management India 2026,"company culture HRMS India, culture tracking HR software India, employee culture platform India, HR culture module India 2026",1500,2026-07-10 07:00
AI in Labour Law Compliance: How Indian Companies Are Sidestepping Costly Disputes in 2026,HR Automation,Pan-India,AI labour law compliance India 2026,"AI legal HR compliance India, labour dispute prevention AI India, employment law automation India, HR compliance AI tool India 2026",1600,2026-07-10 11:30
"The State of HR Outsourcing in India 2026: Market Size, Dominant Players, and Where Growth Is Heading",HR Services,Pan-India,HR outsourcing India 2026 market size players growth,"HR BPO market India 2026, HR outsourcing growth India, managed HR market India size, HR service industry India 2026 report",1800,2026-07-10 17:00
Why India's Highest-Performing Companies in 2026 Are Hiring Entirely for Mindset Over Skillset,AI Recruitment,Pan-India,hiring mindset over skillset India top companies 2026,"attitude over skills India hiring, mindset hire India companies, cultural fit over experience India, hire for potential India 2026",2000,2026-07-10 20:00
